{
  "id": "road-run",
  "template": "runner",
  "version": 1,
  "title": "Road Run",
  "regions": ["cardio", "legs"],
  "framing": "full",
  "seated": true,
  "lowImpact": false,
  "silentSafe": false,
  "durationSec": 90,
  "met": 6,
  "detectors": [{ "id": "jump" }, { "id": "squat" }, { "id": "lean" }],
  "free": true,
  "modes": ["solo"],
  "seo": { "slug": "road-run", "keywords": ["running game", "jump and duck game", "webcam running game"] },
  "catalogue": {
    "tagline": { "en": "Jump, duck and lean through ten worlds.", "tr": "On dünyada zıplayın, eğilin ve yana yaslanın." },
    "about": {
      "en": "Run down the road and dodge what comes at you. Jump over low obstacles, duck under high ones and lean to change lanes, through ten different worlds.",
      "tr": "Yolda koşun ve karşınıza çıkanlardan kaçının. Alçak engellerin üzerinden zıplayın, yüksek olanların altından eğilin, şerit değiştirmek için yana yaslanın; on farklı dünyada."
    },
    "how": [
      { "en": "Stand where the camera sees you from head to feet.", "tr": "Kameranın sizi baştan ayağa gördüğü bir yere durun." },
      { "en": "Jump over low barriers and duck under high ones.", "tr": "Alçak engellerin üzerinden zıplayın, yüksek olanların altından eğilin." },
      { "en": "Lean left or right to change lanes and avoid what blocks yours.", "tr": "Şeridinizi kapatan engelden kaçmak için sola ya da sağa yaslanıp şerit değiştirin." }
    ],
    "measures": [
      { "en": "Whether you jumped, ducked or leaned, and when.", "tr": "Zıplayıp zıplamadığınız, eğilip eğilmediğiniz ya da yaslanıp yaslanmadığınız ve ne zaman olduğu." }
    ],
    "move": "leanLeft",
    "tile": "road-run",
    "order": 11,
    "related": ["knee-sprint", "squat-flap"],
    "seatedNote": { "en": "Lean and duck from a chair. No jumping needed.", "tr": "Sandalyeden yaslanın ve eğilin. Zıplamaya gerek yok." }
  }
}
